{
  "schema_version": 1,
  "summary_id": "11111111-1111-4111-8111-000000000006",
  "flight_id": "11111111-1111-4111-8111-000000000003",
  "mission_snapshot_hash": "aaaaaaaaaaaaaaaaaaaaaaaaaaaaaaaaaaaaaaaaaaaaaaaaaaaaaaaaaaaaaaaa",
  "edge_boot_id": "11111111-1111-4111-8111-000000000004",
  "period_start_edge_monotonic_ns": 1000000000000,
  "period_end_edge_monotonic_ns": 1001000000000,
  "person_count_max": 3,
  "equipment_count_max": 1,
  "min_verified_person_equipment_distance_m": null,
  "metric_pair_count": 0,
  "unverified_pair_count": 1,
  "covered_frames": 15,
  "skipped_frames": 3,
  "quality_reasons": [
    "UNVERIFIED_FRAME_CAPTURE_TIME"
  ],
  "relation_ids": [
    "11111111-1111-4111-8111-000000000001"
  ],
  "zone_revision_ids": [
    "11111111-1111-4111-8111-000000000007"
  ],
  "model_digest": "bbbbbbbbbbbbbbbbbbbbbbbbbbbbbbbbbbbbbbbbbbbbbbbbbbbbbbbbbbbbbbbb"
}
